{
  "type": "agent_message",
  "content": "Here is the report.",
  "truncated": false,
  "artifacts": [
    {
      "artifact_id": "8a3c1b79-b34a-44c8-a567-9c3d5e81b0e7",
      "sha256": "sha256:a3f1a3f1a3f1a3f1a3f1a3f1a3f1a3f1a3f1a3f1a3f1a3f1a3f1a3f1a3f1a3f1",
      "media_type": "text/plain"
    }
  ]
}
